Dealer,Endereços,,,,,,
Top Com (RN),"Av Wilson Rosado,304 Sala 06, Km412, Bairro Aeroporto, Mossoro/RN Tel (84) 999655490",,,,,,
Extra Máquinas (MT),"Av Miguel Sutil, 4001- Areão, Cuiba/MT - Tel (65) 30235151",,,,,,
,"R João Pedro Moreira de Carvalho, 2798 - St Industrial, Sinop/MT - Tel (66) 35310517",,,,,,
,"Av Itrio Correa da Costa, SN - Cidade Salmen, Rondonopolis/MT",,,,,,
Extra Máquinas (GO),"Av Peru, SN,Qd 03 Lt 01D Barracão C1 - B. Vera Cruz, Aparecida de Goiania/GO - Tel (62) 35382470",,,,,,
,"Av Goias, 4435, Qd 14 ,Lt 1, Setor Industrial, Jatai/GO",,,,,,
Extra Máquinas (PA),"Rod. Trasamazonica km 02, Galpão 02, Bairro Floresta, Itaituba/PA - Tel (93) 991288198",,,,,,
,"Br316 KM 21, SN, Campestre, Benevides/PA",,,,,,
,"Rod 230, 09, Nova Marabá, Marabá/PA",,,,,,
Extra Máquinas (SP),"Rod. Anhanguera, 865, Km111, Nova Veneza, Sumare/SP",,,,,,
Campo Forte (ES),"Av Pref Samuel Batista Cruz, 10955, Canivete, Linhares/ES - Tel (27) 33738532",,,,,,
GRA (RS),"RSC 453, SN, Km0,2 Distrito Industrial, Venâncio Aires/RS Tel (51) 984141127",,,,,,
Macromaq (SC),"Rod Br 10, Km210, Picadas do Sul, São Jose/SC Tel (48) 32571555",,,,,,
,"Rua Xanxerê, 360, Bairro Lider, Chapecó/SC Tel (49) 33615400",,,,,,
Robusta/Semi (SP),"Wilson Sabio de Mello, 2160, Distrito Industrial, Franca/SP Tel (16) 37059700",,,,,,
Yamadiesel (PR),"Pista Lateral da Br277, Km113, 540, Campo Largo/PR Tel (41)35553723",,,,,,
,"Pista Lateral da Br277, Km589, 51, Cascavel/PR Tel (45)30976433",,,,,,
Yamadiesel (RJ),"Av Dr Jefferson G. Bruno, 1290, Paraiso II, Resende/RJ Tel (24) 33818485",,,,,,
Zucatelli (MA),"Br010, SN, Km1352, Santa Luzia, Imperatriz/MA Tel (99) 33212102",,,,,,
,"Eng. Emiliano Macieira, 26, Vila José Sarney, São Luis/MA Tel (98) 991259194",,,,,,
Maquiparts (RO),"Av Celso Mazutti, 2615, Bodanese, Vilhena/RO Tel (69) 33224005",,,,,,
,"Rua da Beira, E, 5490, Area Florestal, Porto Velho/RO Tel (69) 32100166",,,,,,
Maquiparts (AC),"Rod AC40, 5461, Vila Acre, Rio Branco/AC Tel (68) 992235045",,,,,,
Cherr (RR),"Trav. dos Macuxis, 1277, Alvorada, Boa Vista/RR Tel (61) 998435844",,,,,,
Justi (BA),"Av. Kiichiro Murata, 314, Jd Imperial, Luis Eduardo Magalhães/BA Tel (77) 36281145",,,,,,
,"Rua Dr Altino Teixeira, 777, Porto Seco Pirajá, Salvador/BA ",,,,,,
ACM  (PB),"Rua Francisco Marques da Fonseca, 200, Imaculada, Bayeux/PB Tel (83) 32325956 ",,,,,,
ACM  (PE),"Av Marechal Mascarenhas de Moraes, 6333, Imbiribeira, Recife/PE Tel (81) 37718823",,,,,,
RRZ (AM),"Av Torquato Tapajos, 3330, Colonia Santo Antonio, Manaus/AM Tel (92) 32282160",,,,,,
Triama Norte (MG),"Via Expressa de Contagem, 4145, Bairro Perobas, Contagem/MG Tel 08002836463",,,,,,
,"Av Dep. Plinio Ribeiro, 937, Esplanada, Montes Claros/MG",,,,,,
Nordeste (SE),"Av Chanceler Osvaldo Aranha, 3122, Olária, Aracaju/SE Tel (83) 981036011",,,,,,
Forza (CE),"Br 116, km17, 9000, Jabuti, Itaitinga/CE Tel (85) 21806000",,,,,,
,"Av Padre Cicero, 4001 - loja01, Muriti, Crato/CE Tel (85) 985454099",,,,,,
MAAC (MS),"Av Perimetral Norte Wilson Beltramin, 2419, Maracaju/MS Tel (67) 34585200",,,,,,
